Titre,Prix,Adresse,Description,Prix_scaled
Imou Bulb Cam 3MP 2k  caméra wifi,37500.0,Plateau Dakar,cmos progressif mégapixelsmp x vision nocturne piobjectif fixe mmchamp vision h v panoramique inclinaisonréseauwifi ieee bgnax ghzapplication imou ios androidonvifvidéo audiocompression vidéo hhfréquence dimages jusquà ipszoom numérique xmicrophone hautparleur intégrés sirèneaudio bidirectionnelinterface auxiliaireemplacement carte micro sd jusquà gomicro hautparleur intégrésbouton réinitialisationgestion avisdétection mouvementrégion configurabledétection humainedétection véhiculegénéral,-0.11558470766093876
Faux plafond en bois,13000.0,Liberte 6 Dakar,faux plafond bois pin hollandaisprix,-0.12449842152888814
Réfrigérateur,800000.0,Yeumbeul Dakar,réfrigérateur bon alimentation epicerie charcuterie,0.16183189741299608
Machine multifonction petit dej,30000.0,Djily mbaye Dakar,machine multifonctions machine café venant qualité a prix imbattable milles garanti,-0.11831339557969878
Déambulateur & béquilles de qualité,53000.0,Hann maristes Dakar,aidez proches a retrouver mobilité après blessure maladie vieillesse outils aident grandement a tenir debout déplacer a maison dehorsvendu a lunitédéambulateur chaise fatigué sassoie haut gamme roues pliable démontable rangement facile lors déplacementsbéquilles sous aisselles avant brasdéambulateur pliable roueslivraison possible,-0.10994541929550139
Chaise/ fauteuil d'aisance/ douche et toilettes,130000.0,Thiès Thiès,chaise daisance qualité professionnelle premium douche toilettes,-0.08193088999623191
Puff cbd 650 bouffe,10000.0,Diamaguene Dakar,xbar cbd offre consommateurs expérience unique arôme naturel allié qualités puissance restitution saveurs xbarcette puff cbd composée eliquide fabriqué france cet eliquide lun seuls monde base terpènes naturels sans aucun agent saveur ajouté lutilisation terpènes permets doffrir got unique vrai got cbd super relaxant,-0.12558989669639214
Puff réutilisable X-bar v2 650 bouffe,5000.0,Diamaguene Dakar,xbar v première puff réutilisable xbar révolutionne puff cette nouvelle version réutilisable fois liquide épuisé pouvez remplir nouveau grce petit bouchon intégré partie supérieure bien entendu possible recharger via usbcmême format sensation saveurs xbar désormais sans limites fini puffs maintenant possibilité lutiliser plusieurs fois eliquide xbar ml permettant davoir jusquà environ puffs,-0.12740902197556547
VENTE ET INSTALLATION DE VIDÉO SURVEILLANCE,,Nord foire Dakar,vente installation vidéo surveillance,
MACHINE DE CAISSE LOGICIEL ACCESSIBLE A DISTANCE,425000.0,Médina Dakar,leader fourniture logiciel machine caisse expérience plus ans domaine proposons package caisse enregistreuse tactile logiciel point vente formationnos packs composé écran caisse tactiletiroir caisseimprimante ticket caisselecteur code barredétecteur faux billetetiqueteuse prixlogiciel caisse version illimité sans redevance accès distanceformation accompagnement,0.025397501474995338
Perceuse et visseuse à 2 batteries,55000.0,Yoff Dakar,big promo fin dannée chez senegal toolsperceuse visseuse ebi max disponible prix imbattablesvenez profiter fête remises exceptionnelleslivraison gratuite dakar,-0.10921776918383205
Vibrateur électrique à béton,130000.0,Yoff Dakar,big promo fin dannée chez senegal toolsvibrateur béton électrique disponible prix imbattablesvenez profiter fête remises exceptionnelleslivraison gratuite dakar,-0.08193088999623191
"Puissant King max 5,5 kva gazoil  triphasé",785000.0,Parcelles Assainies Dakar,désirez avoir énergie chez permanence bien ratez surtout cette spéciale occasionil tout neuf,0.15637452157547604
KIT CAMAERA ANALOGIQUE HIKVISION 8 CAM,200000.0,Médina Dakar,kit caméra analogique hikvision camtous canaux prennent charge lecture synchrone jusquà résolution ptechnologie compression h efficacecapacité dencodage jusquà mpp ipssortie hdmivga simultanéela gestion distance disponible lapplication hikconnect,-0.0564631360878051
CAMERA RESEAU IP TURRET COLOR VU SMART,40000.0,Médina Dakar,caméra réseau ip turret colorvu smart hybrid mp audiocapture grande zone superbes détails tempsimagerie panoramique haute qualité résolution mp imagerie détaillée mpexcellentes performances basse lumière grce technologie darkfighter technologie colorvusécurise zone étendue zoom optique zoom numérique vue nocturne étendue distance ir jusquà lumière blanche mprend charge v cc poese concentre classification cibles humaines véhiculaires basée lapprentissage profond,-0.11467514502135208
Moniteur Acer 32 pouces 165 hz,185000.0,Plateau Dakar,cest écran parfait jouer normalement compétition a utilisé an na aucun problème lécran a plusieurs paramètres très intéressant possibilité mettre viseurs supplémentaires voir dernière photo,-0.061920511925325133
Baignoire 180 x 70,75000.0,Point-e Dakar,baignoire haut gamme non utilisé bazardé prix visite possible point e,-0.10194126806713869
Compresseur 500L,900000.0,Ngaparou Thiès,vends compresseur nuair cvvenu deurope marque italienne heures marchecuve verticale assécheur dairtrès bon état,0.19821440299646292
stylo lampe LED professionnel pour personnel médical,6000.0,Hann maristes Dakar,faible consommation dénergie longue durée dutilisationlumière claire brillanteclip maintenir luniforme facile a transporter,-0.12704519691973082
PUISSANTE EBI MAX à  percussion  1500w,65000.0,Parcelles Assainies Dakar,chers électriciens plombiers particuliers bricoleurs ratez surtout cette spéciale offre cette toute nouvelle perceuse défie autres,-0.10557951862548537
EBI max 48v,62500.0,Parcelles Assainies Dakar,cette puissante perceuse portative travaillez rapidement surtout efficacité partout où accompagnée puissantes batteries rapidement rechargeables,-0.10648908126507203
Vente sable béton & Tous matériaux de construction,15000.0,Cambérène Dakar,livraison partout sénégal,-0.1237707714172188
Portes - Fenêtres-Balcon Métalliques,,Ngor Dakar,portes fenêtresbalcon métalliques,
SCIE A OS SANS LAME 1800mm SMBS,995000.0,Point-e Dakar,ventre matériels charcuterie,0.23277778330075644
ENSEMBLE CLIMATISEUR ARMOIRE + MOTEUR TCL,500000.0,Point-e Dakar,vente matériels électroniques,0.05268438066259549
TRANCHEUSE SAUCISSON ET JAMBON SMBS,495000.0,Point-e Dakar,vente matériels charcuterie,0.05086525538342214
Machine à souder,180000.0,Sacré-cœur Dakar,machine souder perseur,-0.06373963720449848
ELEMENT DE RAYON MURAL 5 ETAGERES,40000.0,Point-e Dakar,vente détagères meubles rayons,-0.11467514502135208
CONGELATEUR VITRINE HORIZONTAL SMBS 912L,595000.0,Point-e Dakar,vente matériels électroniques,0.08724776096688901
Rayon dos à dos avec 2TG : 12 ELEMENTS DE 6 ETAGERES,40000.0,Point-e Dakar,vente détagères rayons,-0.11467514502135208
FRIGO VITRINE CHARCUTERIE SMBS,990000.0,Point-e Dakar,vente darticles électroniques,0.23095865802158308
BALANCE CONNECTEE AVEC IMPRESSION TICKET,625000.0,Point-e Dakar,vente matériels électroniques,0.09816251264192906
FRIGO VITRINE 3 PORTES 1320L SMBS,1110000.0,Point-e Dakar,frigo vitrine portes smbswanter,0.2746176647217433
CONGELATEUR VERTICAL 3PORTES VERSION AMERICAIN 110V,400000.0,Point-e Dakar,wanter liquidons tous articles magasins prix imbattables,0.01630187507912862
CONGELATEUR VITRINE HORIZONTAL,1035000.0,Point-e Dakar,mettons ventes congélateurs horizontalvertical dautres matériels prix abordables,0.24733078553414317
FRIGO VITRINE 2 PORTES 820L,720000.0,Point-e Dakar,wanter materiels electroniques,0.13272589294622258
Agglos de Qualité pour vos projets de construction,350.0,Sicap Liberté Dakar,découvrez agglos solides durables parfait tous travaux construction fabriqués matériaux qualitéles garantissent résistance optimale finition soignée disponibles plusieurs dimensions blocs répondent normes plus stricteslivraison rapide tarifs compétitifs assurés,-0.1291008084851967
Pack Machine Pop Corn,,Médina Dakar,machine popcorn disponible chez sps distributionopération sans effort machine mas éclaté conçue facilité dutilisation permettant produire rapidement efficacement mas éclaté haute qualité sans formation expertise étenduedurable fiable moteur robuste watts garantie an composants base cette machine assure performances longévité constantes fait investissement précieux usines collations boulangeries hôtels magasins dalimentation,
Machine barbe à papa,175000.0,Médina Dakar,machine barbe papa mise point spécialement usage professionnel convainc non seulement design moderne aussi élément chauffant performant aluminium celuici fonctionne puissance kw permet machine datteindre température service très rapidementla machine barbe papa fabriquée acier inoxydable permettant nettoyage facile protège efficacement contre corrosion,-0.06555876248367182
Machine Pop corn 🍿,125000.0,Médina Dakar,machine popcorn disponible chez sps distributionopération sans effort machine mas éclaté conçue facilité dutilisation permettant produire rapidement efficacement mas éclaté haute qualité sans formation expertise étenduedurable fiable moteur robuste watts garantie an composants base cette machine assure performances longévité constantes fait investissement précieux usines collations boulangeries hôtels magasins dalimentation,-0.08375001527540525
Machine Glace 🍦,950000.0,Médina Dakar,machines crème glacée haute qualité machine crème glacée usage commercial machine fabrication crème glacée mobilemachines glaceperformantes pratiques elles permettent proposer glaces onctueuses rafrachissantes temps recordadresse médina rue x blaise diagne,0.21640565578819634
GPS VEHICLE TRACKER,62000.0,Ouakam Dakar,suivi temps réel surveillez véhicules équipements tempsréel grce technologie pointe permet davoir unevue densemble immédiate localisation statutlimitation vitesse assurez sécurité conformité destrajets imposant limitation vitesse véhicules pourréduire risques daccidents améliorer sécurité routièrecadrage zone définissez zones géographiques spécifiques etrecevez alertes instantanées dès quun véhicule appareil entreou sort zones contrôle optimal actifsécoute cabine suivez conversations bord manière discrètepour garantir surveillance accrue comportements assurer lasécurité conducteurs passagersarrêt moteur distance cas durgence raisons desécurité arrêtez moteur véhicule distance offrantainsi contrôle total situationgéofencing créez barrières virtuelles autour véhicules ouzones sensibles permettant recevoir alertes temps réel dèsquun mouvement non autorisé détecté lintérieur àlextérieur zone définiesécurisez gérez surveillez actifs solutionsinnovantes offrant tranquillité desprit totale contrôlesans précédent,-0.10667099379298937
Lit médical électrique.,1400000.0,Almadies Dakar,vends lit médical électrique tout neuf tous accessoires potence incorporéematelas médicalmatelas anti escarres prix ferme définitif,0.38012693091379723
"cylindre spécial  ( biométrie et badge, biométrie et code )",130000.0,Ouakam Dakar,cylindres électroniques représentent avancée significative domaine sécurité daccès faciles installer dispositifs remplacent cylindres mécaniques classiques offrent gestion simplifiée accès via code badge biométrie idéals gestion dun logement location saisonnière locaux professionnels cylindres connectés offrent flexibilité contrôle accèsle cylindre électronique connecté parfait ceux souhaitent gestion intelligente accès permet ainsi définir accès temporaires permanents selon besoins fini temps clés physiques pouvez désormais accorder autorisations distance employés invités locataires cylindre sinstalle simplement place tout cylindre classique offrant solution moderne pratique sécuriser espaces,-0.08193088999623191
Matela anti escarre( orthopédie),75000.0,Guediawaye Dakar,matela orthopédique place neuf,-0.10194126806713869
Portes à  vendre,15000.0,Keur Massar Dakar,version américaine cm x cmportes vitrées ideale salon cuisine couloir spatiowanter premier venu premier servi,-0.1237707714172188
Conteneur Aménagé en Bureau / Conteneur vide,,Colobane Dakar,vente conteneur vide aménagé dakar partout sénégalnous spécialistes vente conteneurs vide conteneur aménagés dakar partout sénégalnous proposons vente conteneurs vide conteneurs aménagés pied pieds tous besoins disposons tous type conteneur aménagés,
vente Reservoir D' Eau Verticale et Horizontale,65000.0,Plateau Dakar,mettons vente réservoir deau tout capacité,-0.10557951862548537
Conteneur pres Fabriqué / Box ou Bangalow près Fabriqué,,Plateau Dakar,entreprise sénégalais basée dakar réalisons conteneurs près fabriqué panneaux chandwich usinage bureau toulette sanitaire poste garde base vie merci contacter si besoins tout sorte projet conteneurs près fabriqué,
Ventouse 300KG + support,49500.0,Ouakam Dakar,support jusquà kg parfaite sécuriser grandes portes compris environnements exigeants comme issues secourssécurité renforcée système antidémontage intégré minimiser risques vandalisme contact hall permettant vérifier tout moment si ventouse verrouillée déverrouilléealimentation simplicité fonctionne tension continue v v dc sans nuisance sonore idéale environnements nécessitant discrétion fiabilitédéverrouillage cas panne cas coupure courant évacuation durgence ventouse déverrouille automatiquement garantissant sécurité maximalefacilité dinstallation raccordement simplifié grce bornier vis permettant mise place rapide sécurisée,-0.11121880699092274
Prise connectée intelligente,17000.0,Ouakam Dakar,contrôlez surveillez consommation dénergie directement depuis lapplication solution pratique maison plus économe énergiecette prise intelligente compatible alexa google home offre design ultramince permettant garder laccès deuxième prise idéale encombrer espacesprogrammez appareils simuler présence lorsque absent dissuadant ainsi intrus apportant tranquillité desprit inestimableen seulement minutes prêt lutiliser branchez prise connectezla wifi ghz contrôlez appareils sans effort lapplication intuitivela prise intelligente idéale maison connectée sécurisée économe énergie,-0.12304312130554947
Nettoyeur Haute Pression sans Fil avec 2 batteries 48V,35000.0,Grand-Dakar Dakar,nettoyeur haute pression sans fil v w pistolet eau portable haute pression batterie nettoyeur haute pression sans fil portable accessoires voitures nettoyage maison jardin,-0.11649427030052542
Kit solaire avec 3 ampoules avec radio fm,17500.0,Grand-Dakar Dakar,portable solaire éclairage secours puissance bluetooth radio hautparleur eucaractéristiquescharge panneau solaire prise charge charge panneau solaire vw w placez panneau solaire sous lumière soleil pouvez charger produitchargement ac v pouvez connecter alimentation ac externe obtenir charge rapidebatterie plombacide rechargeable intégrée mah haute capacité longue durée vie batteriesortie dc v pouvez connecter petite ampoule plus pratique léclairagechargement sortie usb sortie usb v bonne compatibilité peut charger téléphones portables répondre besoins charge divers produits électroniquescôté led haute luminosité etc peut être utilisé comme lampe table aussi comme lampe torche maison lextérieur spécial urgences panne courant,-0.12286120877763212
Lampe solaire rechargeable 350w avec powerbank,20000.0,Grand-Dakar Dakar,luminosité réglable multiple lampe travail led sans fil conçue interrupteurs peuvent contrôler puissance travail luminosité peut être ajustée lobscurité lumière,-0.12195164613804546
SMART CAMERA CALLING,47000.0,Ouakam Dakar,découvrez smart caméra exceptionnelle images dune clarté remarquable communication vidéo bidirectionnelle fluide profitez dune détection temps réel sécurité renforcée tout bénéficiant multiples options stockage enregistrements communication vocale claire restez connecté toute simplicité,-0.1121283696305094
Détecteur de fumée connecté,27000.0,Ouakam Dakar,détecteur fumée intelligent xswx connecte directement lapplication disponible playstore applestore via wifi ghz permettant recevoir notifications temps réel alarmes pannes piles faibles durée vie ans offre détection fiable incendies grce capteur photoélectrique compact léger mm facile transporter idéal voyages plus lapplication permet partager dispositif jusquà utilisateurs garantissant sécurité partagée toute famille,-0.11940487074720278
"Kit de glucomètre pour test de glycémie, testeur de diabète",15000.0,Castor Dakar,descriptionkit surveillance glycémie kit test glycémie bandelettes test glycémie lancettes diabétiquesun kit surveillance glycémie appareil pratique comprend bandelettes test glycémie lancette effectuer tests glycémie principalement utilisé patients diabétiques surveiller taux sucre sang afin quils puissent suivrede leurs propres conditions glycémieles trousses surveillance glycémie comprennent généralement bandelettes test glycémie lancettes bandelettes test glycémie bandelettes capteur utilisées tester taux sucre sang échantillon sang lancette petit instrument utilisé prélever doucement gouttedéchantillon sang bout doigtun kit gluconate lecteur glycémie type courant kit surveillance glycémie utilise bandelettes gluconate mesurent glycémie affichent résultats généralement équipé dun instrument surveillance lit valeur glycémieindiquée bandelette testles tests glycémie peuvent être facilement effectués kit surveillance glycémie suffit lutilisateur dinsérer bandelette test moniteur puis prélever doucement goutte sang bout doigt laide dune lancette lajouter bandelette test linstrumentlira automatiquement valeur glycémie laffichera lécran permettant utilisateurs comprendre rapidement taux sucre sanglutilisation dun kit surveillance glycémie très importante patients diabétiques surveillant niveaux sucre sang patients peuvent ajuster régime alimentaire leurs médicaments mode vie temps maintenir glycémie stable commodité précision trousses surveillance glycémierendent prise charge diabète plus pratique plus pratiquecaractéristiquesperformances puce puissantes analyse rapide obtient résultats secondesseule petite quantité sang nécessairedeux unités convertissable entre mmoll mgdlune pression faire sortir bandelette test eviter pollutionspécificationapplication doigtalimentation pile bouton cr incluseunité mmoll mgdlplage test mmoll mgdléchantillon test sang total capillairevolume dajout minimum ultemps test sexigence batterie bouton cr vautonomie batterie environ fois testvaleur mémoire foisplage hct température fonctionnement ccomment utiliser insérez bandelette test lecteur glycémiemettez lancette lappareil prélèvement sanguinutilisez appareil prélèvement sanguin percer doigt laissez sang sécoulerrecueillez petite quantité sang extrémité bandelette test sanguinen attente résultat testbandelette test contextuelleremarqueveuillez utiliser bandelettes test mois après avoir ouvert flaconsi besoin plus bandelettes test glycémie daiguilles prélèvement sanguin veuillez rendre magasin acheterafin garantir lexactitude résultats mesure veuillez acheter papier test glycémie correspondant machinene buvez dalcoolles botes instructions glucomètre toutes anglaisglucomètre qualité médicale lhôpital utilise également produit résultats test glucomètre précismeilleur moment mesurer glycémie plasmatique jeun moins heures sans aucun aliment sauf leau heures après repas timing commence dès première bouchéeplage normale glycémie jeun fbg moll mgdl glycémie postprandiale heures après repas moll mgdlformule conversion dunité concentration glucose sang a généralement deux méthodes lune mmoll lautre mgdl deux unités concentration glucose peuvent être converties lune lautre coefficient conversion converti mmoll mgdl cest premier mmoll multiplié linverse mgdl mmoll cest premier mgdl divisé échantillon test faut attendre lalcool volatilise complètement car lalcool résiduel affectera valeurs mesurées premier sang collecté peut être utilisé comme échantillon test car peut être mélangé liquide tissulaireemballage inclus lecteur glycémie pile bouton instrument prélèvement sanguin bote plastique pièces bandelettes test pièces lancettes,-0.1237707714172188
extincteur,,Plateau Dakar,khelcome business offre extincteurs qualité sécurité maisons prévenir incendie gaz cuisine entreprises voitures autres afin prévenir incendie poudre abc kg kg kg kg kg co kg kg kg kg service livraison disponible,
réservoir,,Plateau Dakar,khelcome business offre réservoirs deau cuve baril deau jusquà service livraison disponible,
grillage,,Plateau Dakar,khelcome business offre clôtures grillages air jeux rigide grillage pvc grille clôture tendeur fil tendeur galva fil tension poteau piquet jambe force poteau tension piquet tension barbelés sécurité maisons entreprises terrains champs autres service pose livraison disponible,
BATTERIE lithium LiFePO4 10kWh,1.0,Avenue Bourguiba Dakar,batterie lithium kwtension nominale v capacité nominale ah ahpoids kgélectricité tension décharge vtension charge vcourant charge maximal a crêteonduleur puissance londuleur w alimentation dc dentrée dcvdurée vie conception years,-0.129227783429683
Carreaux Sols 60x60 mats antidérapants,7800.0,Dalifort Dakar,carreaux sols x mats antidérapantsnb stock limité,-0.1263903118192284
Carreaux Mat,,Dalifort Dakar,carreaux mat,
Entreprise Royal BTP,1.0,Parcelles Assainies Dakar,royal btp cur services btpcontacteznous toutes prestations servicesdémolitionévaluationinstallation délectricitéplan ddcreusage fouillelocation dengins lourdes,-0.129227783429683
Cabine Hydromassage,,Parcelles Assainies Dakar,special promo chez aad suarl toujours bon choix douche vapeursi recherchez produit laisse rien désirer sadapte néanmoins petites salles bains cette cabine douche vapeur solution parfaite vousune utilisation normale douchette main réglable laide barre douche fournie également possible design moderne associé bonne fonctionnalité complète bestseller détendez bain remous sous lumière apaisante led intégrées panneau central détendez sous pluie tropicale chaude évacuez stress bain vapeur option également arôme parfumé système désinfection lozone intégré garantit nettoyage sans résidus respectueux lenvironnement siège enfermé baignoire structure antidérapante fond baignoire garantissent utilisation toute sécurité massage pieds intégré thérapie réflexologie détendue jets massage dos intégrés panneau central derrière siège massant dos rendent lexpérience relaxation parfaite non seulement fonctionnalités exceptionnelles qualité également plus juste prix indiqué,
Compresseur a air sangola 781,125000.0,Castor Dakar,compresseur a air sagola,-0.08375001527540525
Jacuzzi,,Parcelles Assainies Dakar,specialpromo fin danee chez aadgrce taille impressionnante deux appuitête visuellement attrayants bain remous peut facilement être utilisé deux personnes quatre grands jets réglables six jets corporels douze jets dair assurent expérience relaxation parfaite bien entendu pouvez également utiliser bain remous comme baignoire normale design moderne combiné bonne fonctionnalité rend bestseller complet asseyez profitez dun moment apaisant bain remous tandis luminothérapie innovante fait briller leau couleurs douces apaisantes non seulement fonctionnalités exceptionnelles qualité également plus juste prix indiqué convient particulièrement noter lacrylique sanitaire brillant renforcé ferrures haute qualité construction cadre aluminium lélément commande tactile commandé ordinateur pieds réglables hauteur baignoire sadaptent presque toutes surfaces permettent installation facile nimporte oùavec aad opter confort qualité,
Vitrine pour conservation et vente,250000.0,Diamaguene Dakar,cest vitrine peut être utilisée vendeurs conserver vaisselles autres maison partout ailleurs,-0.038271883296071674
Dji OSMO mobile 6 Smartphone Gimbal,120000.0,Almadies 2 Dakar,marque djitempérature fonctionnement cangle contrôle pan to angle contrôle tilt to angle contrôle roll to vitesse rotation maxpoids nacelle g bride smartphone gdimensions déplié x x mm x x h plié x x mm x x hautonomie heures minbatterie lipo stemps charge heure mincompatibilité tout smartphones mesurant mm mm thickness of mm and weight of gapplication dji mimo app disponible android ioscharge utile g maxconnexion usbc bluetooth,-0.0855691405545786
Groupe électrogène Diesel PRAMAC GBW 15 KVA,3700000.0,Pikine Dakar,jai générateur diesel pramac gbw kva vendremoteur perkins dgenceinte insonorisée silencieusele pramac gbw fiable applications nécessitant puissance continue secours consommation carburant optimisée fonctionnement silencieuxentretient complet filtre gasoil filtre air filtre huile vidange wimporté france vendu millions fcfa,1.2169245593335352
