Titre,Prix,Adresse,Description,Prix_scaled
"Bande Kinésiologie, Thérapeutique, 1 Rouleau 5m x 5cm",6000.0,Castor Dakar,kinesio tape bienfaits physiothérapiesaviezvous quil existe aujourdhui plus marques bandes kinésiologie marché produit original kinesio tape kinesio tex tape a développé années dr kenzo kase chiropracteur japonais recherchait bande offre soutien limite mouvements comme font plupart bandes athlétiques traditionnellessi déjà assisté course cycliste match volleyball lavez probablement déjà vu bandes ruban adhésif coloré disposées motifs épaules genoux dos abdominaux athlètesce bandes kinésiologie bande thérapeutique appliquée stratégiquement corps fournir soutien plus bandes réduisent lenflure atténuent douleur améliorent performances passionnés rapportent succès plupart bandes utilisées traitements physiothérapie faut faire plus recherches clarifier exactement kinésiologie peut peut fairenous discutons ici manière dont physiothérapeutes thérapeutes sportifs lutilisent avantages quelques conseils devez savoir bandesquestce thérapie bandes kinésiologiques kinesio tape sagit bandes thérapeutiques élastiques souvent appelées kinésiologie kinésio encore ktape sagit dune méthode rééducation peut faciliter processus naturel guérison corpsces bandes offrent généralement soutien stabilité muscles articulations sans restreindre lamplitude mouvements corps ruban largement utilisé physiothérapeutes modifier tonus musculaire corriger schémas mouvement déplacer fluides lymphatiques également améliorer posturele ktape fait ruban thérapeutique appliqué corps aide réduire lenflure soulager douleur améliorer fonctionnalité processus consiste placer bandes ruban kinesio corps spécialiste placera bandes directions spécifiques fins thérapeutiquescomment fonctionne kinesio tape kinesiology taping bandes kinésiologie bandes adhésives résistantes leau extensibles généralement fabriquées nylon coton pouvez imaginer comme peau élastique permettra gamme complète mouvementslorsque appliquez ruban adhésif soulève doucement peau recourbant processus permet créer espace microscopique entre peau tissus situés dessousles tissus sous peau contiennent récepteurs sensoriels réagissent sensation toucher léger douleur température également responsables détection proprioceptionle ruban kinésio aide décompresser tissus ruban envoie nouveaux signaux cerveau lorsque cerveau reçoit signaux réagit différemmentles bandes kinesio mélange nylon coton conception bande imite lélasticité peau permettant dutiliser toute amplitude mouvement notez conception adhésive qualité médicale bande telle quelle adhère fermement peau car résistante leau bande également suffisamment solide coller pendant cinq jours collera pendant faites lexercice prenez douche ruban kinesio crée lespace articulationsune petite étude a montré lapplication bandes kinesio genou augmente souvent lespace entre articulations genou autre étude similaire a prouvé bandes kinesio pouvaient augmenter lespace larticulation lépaule toutes études indiquent si laugmentation surface très faible contribue réduire risques dirritation articulaire signaux changement bande kinesio voies douleurcertains physiothérapeutes pensent également ruban adhésif peut modifier informations envoyées système nerveux sensoriel concernant douleur compression différentes parties corpsmais dr megann schooley spécialiste clinique certifiée physiothérapie sportive a explication différente tous tissus comme tissu conjonctif peau fascias muscles contiennent récepteurs sensoriels cest pourquoi ressentez douleur toucher température récepteurs contribuent proprioception perception cerveau lendroit où trouve corps quil faitil également important noter taping kinesio crée soulèvement peau peut décharger tissus sousjacents tissus décompressés modifient signaux envoyés cerveau lorsque cerveau reçoit mouvements différents réagit différemmentles points déclenchement bon exemple physiothérapeutes utilisent bandes kinesio soulever peau audessus muscles noués tendus lorsque zone traitée décompresse récepteurs douleur envoient nouveau signal cerveau entrane diminution tension point déclenchement bandes kinesio améliorent circulation sang fluidesen cas blessure ruban kinesio peut aider améliorer circulation zone réduire lenflure selon étude ruban peut améliorer circulation sanguine peau peut également améliorer circulation fluides lymphatiquesle liquide lymphatique constitué deau grande quantité peut également contenir dautres substances telles bactéries protéines dautres substances chimiques noubliez système lymphatique seul responsable régulation laccumulation liquide gonflement corpsla théorie derrière cela lorsque spécialiste applique ruban kinesio crée espace souscutané supplémentaire cela modifie gradient pression zone située sous peau changement pression améliore drainage lymphatique autour zone modifiant flux liquide lymphatique ecchymoses peuvent guérir plus rapidementà quoi sert kinesio tape traitement blessuresvos physiothérapeutes peuvent parfois utiliser ruban adhésif kinésiologique cadre dun plan traitement global notamment si blessé selon lamerican physical therapy association ruban adhésif kinésiologique plus efficace lorsquil associé dautres traitements comme thérapie manuelle soutenir zones faiblesvous pouvez également utiliser ruban adhésif soutenir articulations muscles besoin si souffrez syndrome friction bandelette iliotibiale dune tendinite dachille dun syndrome stress fémoropatellaire ruban adhésif kinesio peut être dune grande aidecontrairement ruban adhésif athlétique ruban adhésif kinésiologique permettra bouger normalement études montrent quil peut améliorer mouvements endurance selon études menées athlètes ruban adhésif kinésiologique améliore considérablement performances muscles fatigués amélioration performancesil intéressant noter certains athlètes utilisent taping kinésiologique aider atteindre performances optimales ruban aide également protéger contre blessures lorsquils participent événements grande envergureil intéressant noter coureurs utilisent ruban chaque fois quils courent marathon placent long fessier réveiller muscle rappeler continuer travailler rééduquer musclesvotre médecin peut utiliser ruban adhésif aider rééduquer muscles perdu fonction muscles habitués mode fonctionnement malsain méthode kinesio taping peut également corriger posture cou tête selon étude ruban adhésif peut aider patients victimes dun avc améliorer façon marcherles physiothérapeutes pensent raison principale sensation étrange ruban adhésif peau peut rendre plus conscient façon dont tenez debout mouvements gérer cicatricesnutilisez jamais sparadrap plaie ouverte certaines études scientifiques suggèrent sparadrap utilisé physiothérapie peut également améliorer lapparence cicatrices long terme plus efficace lorsque lutilisez après blessure intervention chirurgicale devez discuter plan traitement médecin spécialistetypes bandes kinésiovous pouvez appliquer ktape forme x i web fan donut fonction taille forme muscle concerné résultat obtenir pouvez décider forme rubanruban adhésif lapplication ruban généralement utilisée pourle ruban doit être pouces plus long muscle cibleil doit entourer muscle cibleil facilite stimulations musculairesbande i lapplication ruban adhésif i souvent utilisée pourdème douleuren cas blessures graves utilisez ruban adhésif pouvez lutiliser corrections dalignementruban adhésif x lapplication bande x utilisée lorsque lorigine lintersection muscle cible changent particulier lorsque cela dépend mouvement exemple rhombodesbande fan web lapplication bandes éventail toile utilisée dèmes notez toile différente car extrémités restent intactesruban donut dèmes utilise ruban adhésif donut faut utiliser bandes chevauchent découper centre zone cibléecomment appliquer kinesio tape postuler suivez étapes simples séchez nettoyez dabord zone car lotions huiles empêchent souvent ruban collercoupez poils superflus zone notez poils fins doivent être bien maintenus poils denses peuvent empêcher ruban adhésif davoir bonne adhérencepour plupart traitements spécialiste commencera déchirer papier support centrevous pouvez couper coins arrondis extrémités chaque bande coins arrondis saccrocheront vêtements permettra ruban rester place plus longtempsgardez doigts papier demballage tenir ruban adhésif lieu partie adhésivelorsque appliquez première languette laissez lextrémité rétracter légèrement fois retiré papier protecteur doit avoir détirement deux derniers centimètres deux extrémités notez si étirez extrémités ruban tour tirera peau pourrait lirritervotre thérapeute pourrait être personne mieux placée indiquer degré détirement utiliser pendant traitement zoneaprès avoir appliqué ruban adhésif frottez vigoureusement bande chaleur générée activera colle noubliez ladhérence complète prendra environ minutes,-0.12704519691973082
BATTERIE 100AH/12V,1.0,Avenue Bourguiba Dakar,batterie agmmarque ritarcapacite ahvoltage design life years floating charge,-0.129227783429683
EQUIPEMENTS ET ACCESSOIRES SANITAIRES,85000.0,Parcelles Assainies Dakar,découvrez gammes produits chez btiment déco produits accessoires sanitaires bien disponibles magasin nhésitez contacter plus dinformationsnb prix différents,-0.098303017508792
"Mini souffleur à air comprimé, 130 000 tr/min",13000.0,Castor Dakar,dépoussiéreur air comprimé puissant souffleur dair électrique portable trmin ventilateur turbo vitesses nettoyeur clavier ventilateur jet chargement usb barbecue extérieur pompe airmoteur sans balais puissant dépoussiéreur air comprimé doté dun moteur sans balais grande vitesse régime maximal trmin dépoussiéreur air électrique fournit vents forts souffler poussière éliminer saleté divers interstices claviers appareils électroniquespetit puissant dépoussiéreur portable léger g équivaut seulement deux rouges lèvres poids peut facilement glisser poches sacs bandoulière pouvez également choisir mode puissant offrir lexpérience dun vent fort cest bonne aide lorsque voyagezbatterie longue durée dépoussiéreur livré batteries intégrées mah offrant heures fonctionnement continu mode doux peut être complètement chargé heures laide cble charge typec inclus notez quun adaptateur nest inclus peut être chargé nimporte quel chargeur usb cremplacement économe énergie dépoussiéreur sans fil fabriqué matériaux haute dureté résistants hautes températures texture parfaite forte puissance explosive peut être rechargé utilisé plusieurs reprises dépoussiéreur air comprimé excellent remplacement dépoussiéreurs air comprimé traditionnels peut être rechargé utilisé plusieurs reprises rend écologique économe énergie rentablelargement utilisé souffleur dair peut être excellent nettoyeur clavier dépoussiéreur air comprimé canapés souffleur dair portable nest seulement brisepoussière peut également être utilisé comme ventilateur portatif sèchecheveux éliminez facilement poussière éliminez résidus deau voiture allumez barbecue gonflez flotteurs piscine constituez également cadeau attentionnéoutil nettoyage multifonction claviers dordinateur activités plein air comme camping barbecues souffleur dair électrique solution toutenun parfait nettoyage préciscaractéristiquestype produit souffleur air comprimétaille nw lbsvitesse trminmoteur moteur sans balaisfonction air froidpuissance nominale wvitesse lair msmodes dalimentation v camatériau abscapacité batterie x mah,-0.12449842152888814
CABINE DE DOUCHE OU VITRE DE SÉPARATION,138000.0,Parcelles Assainies Dakar,cabine douche xx transparent éléments fixes parois coulissantesouverture anglefermeture magnétiquecoulissement chariot double roulettessystème déplissage portespoignées absverre sécurité transparent épaisseur mm parties fixes mm parois mobiles verre bombévitre séparationparoi douchecabien douche,-0.07902028954955456
PACKAGE CAISSE ENREGISTREUSE TACTILE,475000.0,Médina Dakar,leader fourniture logiciel machine caisse expérience plus ans domaine proposons package caisse enregistreuse tactile logiciel point vente formationnos packs composé écran caisse tactiletiroir caisseimprimante ticket caisselecteur code barredétecteur faux billetetiqueteuse prixlogiciel caisse version illimité sans redevance accès distanceformation accompagnement,0.04358875426672877
Réchauds électrique double,,Yoff Dakar,arrivage rechaud electrique multifonctionpuissance x w voltage vboitier acier inoxydable bruleur rayonnement infrarougeeconomie énergie chauffage poidskgrechauddoublecuisineprofessionnelledakakarchronoyoffngaparoupetitecote,
MACHINE DE CAISSE COMPLETE AVE LOGICIEL,425000.0,Médina Dakar,leader fourniture logiciel machine caisse expérience plus ans domaine proposons package caisse enregistreuse tactile logiciel point vente formationnos packs composé écran caisse tactiletiroir caisseimprimante ticket caisselecteur code barredétecteur faux billetetiqueteuse prixlogiciel caisse version illimité sans redevance accès distanceformation accompagnement,0.025397501474995338
CAMERA ANALOGIQUE HYBRIDE 2MP COULEUR ET VOIX HIKVISION,15000.0,Liberte 2 Dakar,imagerie haute qualité résolution mp objectif focal fixe mm mmjusquà distance ir imagerie nocturne lumineusejusquà distance lumière blanche imagerie nocturne lumineuseun port quatre signaux commutables tviahdcvicvbsaudio haute qualité audio cble coaxial micro intégrérésistant leau poussière ipéclairage hybride intelligent optimisez sécurité options déclairage flexibles,-0.1237707714172188
POMPE SOLAIRE 140w,1.0,Avenue Bourguiba Dakar,pompe solairemodel tbinpuissance wtension dcvprofondeur mdebit hprotection ip,-0.129227783429683
TOURNEVIS-BURINS,30000.0,Mbour Thiès,tournevisburins piècespointe aimantée manche antidérapant bimatiereheurtoir petits travaux burinembase hexagonale meilleure transmission force fixations muralesproduit neuf a,-0.11831339557969878
THERMOSOUDEUSE SOUDURE PLASTIQUE,15000.0,Fass Dakar,thermosoudeuse plastiquesoudeuse thermique sacs plastique pepp fonctionnement simplela pression active limpulsion électrique chauffe scelle plastique peut être laissé connecté réseau électrique puisquil consomme lorsque levier actionné idéal ensacher sceller tout type dobjet lintérieur dun sac plastiquecaractéristique thermosoudeuse levier zone détanchéité cmminuterie soudure réglable secondespuissance consommation wwwil fonctionne vac hzcomprend tissu remplacementprix varient fonction models,-0.1237707714172188
Balance industrielle étalonnée 100kg et 150kg,,Yoff Dakar,arrivage balance industrielle déjà étalonnée kg kgbalance précision acier inoxydable,
Détecteur de monoxyde de carbone digital FANCY HOME,4000.0,Golf Dakar,détecteur monoxyde carbone digital sensibilité ppm fancy homele détecteur monoxyde carbone lcd co fancy home capteur permanent émet signal sonore led rouge clignote cas détection co dangereux dispose dune fonction mémorisation dalarme dun bouton testréinitialisation fonctionne piles aa non fournies a sensibilité ppm couleur blanche mesure x cmcapteur monoxyde carbone permanent signal sonore lalarme composé quatre bips dalarme courtsla led rouge clignote mode alarmeun chirp toutes secondes indiquer batterie faible besoin remplacement voyant vert clignote toujours toutes secondesbouton test réinitialisation tester lélectronique lappareil vérifier bon fonctionnement lunité réinitialiser lappareil pendant lalarme cofonction mémorisation dalarme si lappareil a déjà alarmes appuyant touche led verte clignote fois seconde pendant minute niveau dalarme crête indiqué lécran lcdvoyants verts rouges indiquent fonctionnement normal létat lalarmelappareil émet signal sonore led rouge clignote fois lorsque lappareil sous tensionvoyant vert clignote toutes secondes indiquer lappareil fonctionne correctement témoin vert clignotera également avant lecture co prise quand bouton quelconque appuyéled rouge lorsquun niveau dangereux monoxyde carbone détecté del rouge sallume signal sonore retentitle motif dalarme monoxyde carbone bips courts suivis secondes silence suivis bips courts flash led rouge correspondant cycle poursuit pendant minutes puis passe cycle toutes minutes jusquà lappareil réinitialisé co éliminéspécificationalimentation piles aa non fourniessensibilité temps ppm alarmes minutes ppm alarme minutes ppm alarmes minutescourant veille,-0.12777284703140016
DAHUA DH-IPC-HFW2449S-S-IL SMART DUAL LIGHT,65000.0,Plateau Dakar,oeil caméra ip extérieur mp microphone intégré ir couleur double éclairage dahua ipchdwtsildescription produit type produit oeil caméra surveillance ip marque dahua modèle dhipchfwssil résolution mp forme bullet poe v placement extérieur degré protection ip microphone intégré oui hautparleur intégré non couleur blanc distance mise point mm fps intelligence détection mouvement éclairage infrarouge emplacement carte mémoire go compression vidéo hc,-0.10557951862548537
Distributeur de boissons,,Ouakam Dakar,machine granités x machine granités bols peut produire x tasses granités ml tasse heure permet satisfaire grand nombre personnes temps plus granités boissons glacées peuvent être produits séparément fermez yeux dégustez passion boissons frachesréfrigération mélange rapides système réfrigération présente dexcellentes performances refroidissement rapide production efficace granités spécialement conçus commerce boissons glacées dété puissant compresseur w a capacité réfrigération rapide permet déconomiser lénergie tout maintenant fonctionnement silencieuxqualité imbattable préparezvous avoir machine granités sait voulez machine entièrement fabriquée acier inoxydable haute qualité alimentaire résistant corrosion rouille supporte haute pression facile nettoyer lignes guidage graduées cylindre rappellent quil faut réapprovisionner matière première tempspanneau commande précis distributeur granités équipé dun panneau commande simple utiliser chaque bol peut être utilisé indépendamment affichage numérique clair réglage dureté fonction besoins na jamais aussi facile fonctionnement simple touche permet servir boissons glacées préférées existe également réglages minutieux lautonettoyagediverses boissons tous cette machine boissons glacées peut préparer nombreux types boissons comme margaritas slushies café glacé boissons alcoolisées boissons fruits smoothies idéal restaurants bars soirées weekend distilleries thé salons manucure parfait usage domestique comme commercial,
Chaise suspendu,200000.0,Sacré-cœur Dakar,package chaise suspendu bati support venant ditalie,-0.0564631360878051
Tensiomètre électronique,12000.0,Nord foire Dakar,machine numérique bp haut bras sphygmomanometer électronique numérique entièrement automatique,-0.12486224658472281
AIR FRYER SONIFER 4.2 L,33000.0,Point-e Dakar,friteuse air puissanteil sagit dune friteuse air puissante dotée dune puissance w dune température maximale degrés celsius dune capacité dun cercle dair chaud degréscontrôle précis températurecomparé friteuses ordinaires sonifer sf a contrôle précis température plage degrés celsiusécran tactile delavec conception tactile led pouvez facilement contrôler cette friteuse air lécran tactile comporte touches contrôle température touche commutation température bouton démarragedesign ergonomiqueil a menu incliné dessus friteuse air pratique utiliser disponible nombreux types daliments tels steak poulet crevettes poisson pizza gteaux légumes chacun a marqué température correspondante temps requiscapacité ldune grande capacité capable cuire poulet plusieurs portions frites dailes pouletpoignée antibrlureavec conception poignée antibrlure ny a besoin sinquiéter dêtre brlé lors lutilisation plus sr plus confortablecirculation dair chaud degrésla circulation dair chaud tout pourtour peut garantir aliments complètement cuits plus sains délicieuxrevêtement antiadhésif facile nettoyerla friteuse air a revêtement antiadhésif navez donc soucier aliments collent poêle poêle frire peut être retirée séparément placée lavevaisselle nettoyage très pratique,-0.11722192041219476
Étanchéité de qualité venant d'Italie,1.0,Castor Dakar,bonjourétanchéité qualité venant ditalie prix défiant toutes concurrences kou yékhe niake,-0.129227783429683
Kit d'éclairage Clamp CL-03 Système d'éclairage solaire,16000.0,Castor Dakar,kit déclairage cclamp cl cclamp cl panneau solairekit sunlight lumières led cbles mini projecteur w batterie externe chargement mobile meilleur outil camping randonnée etc avoir lumière lalimentation appareils tout moment tout lieudes gadgets légers rechargeables partoutun panneau solaire aidera obtenir source lumière recharger appareils où bénéficiez dune source dénergie autonome si lalimentation électrique centralisée nature éteintela lampe poche led portative ampoules constitueront alternative sre écologique bougies lorsquil ny a dalimentation secteur ainsi nature laide dun cble usb universel pouvez recharger smartphone rester connectécaractéristiquestype produit kit déclairagemarque cclampmodèle clpuissance w,-0.12340694636138413
Balance 200KG électronique,30000.0,Grand-Yoff Dakar,balance électronique capacité kg comme photo très bonne qualité affichage prix quantité prix total très pratique boutique gp pressing etcplus dinfos contacterlivraison partout dakar plus,-0.11831339557969878
"Échelle escabeau, parasols de terrasse",1.0,Hlm Dakar,échelle escabeau aluminium marque allemande parkside parasols inclinables terrasses autres packs tournevis multiprises articulées multiprises extérieures marques allemandesdisponible,-0.129227783429683
GENERATEUR ELECTRIQUE,321000.0,Ouakam Dakar,generateur electriquemoteur cc génère jusquà watts surtension watts nominaleproduit lénergie propre éviter dendommager appareils électroniques sensibles tels téléphones intelligents tablettes ordinateurs portablesle capteur darrêt co wen watchdog aide protéger famille éteignant automatiquement générateur si niveaux dangereux monoxyde carbone détectéslarrêt carburant maximise durée vie génératrice utilisant carburant restant carburateur avant larrêtercomprend deux prises v trois branches prise rv ttr prise v dc deux ports usb v,-0.012440304331810198
Pilonneuse Bomag Bvt 65,600000.0,Parcelles Assainies Dakar,protection moteur assure sécurité maximum contre dommages chantier chute plateforme camion nendommage plastique spécial filtrage double lair modèles essence série bt offre disponibilité maximale prolonge durée vie machine coupe allume immédiatement moteur carburant réglage hauteur guidon antivibrations sadapte chaque conducteur garantit travail sans fatigue,0.08906688624606235
Réfrigérateur professionnel pâtisserie,300000.0,Avenue Bourguiba Dakar,bonjour vends frigo professionnel ptisserie gteaux dessertprix très intéressantrévision entretien faite ya mois bonne occasion,-0.02008063050433824
Petite Machine à Jane Multifonctionnelle pour Terre Agricole,250000.0,Hann maristes Dakar,petite machine jane multifonctionnelle terre agricole diesel appareil domestique age fraises distance sablage fossé,-0.038271883296071674
"Semoir Manuel, Semoir de Précision, Semoir Portatif, ...",250000.0,Hann maristes Dakar,semoir manuel semoir précision semoir portatif cacahuète mas haricot épandeur semences jardin précision semis simultané rangs protégez lenvironnement brlez paille retournez champ devenir lengrais cultivez champs blé dalles résistez vent chute fonctionnement humain semis usage unique type marche facile dutilisation femmes personnes gées petit pratique terrasses coteaux cultures intercalaires réapprovisionnement champs tout adapté semis précision semez uniformément semis précision variété semis graines coriandre choux radis autres légumes,-0.038271883296071674
HP ELITE BOOK 840 G3 ( Ordinateur Portable ),175000.0,Guediawaye Dakar,hp élite book g go ram bitintel core iu ghzmicrosoft windows prointelr hd graphics licence windows clé active go espace disqueprofessionnel élite book,-0.06555876248367182
Vibreur à beton,200000.0,Plateau Dakar,moteur essence vibrateur béton robuste hp temps caractéristiques type produit vibrateur béton essence diamètre décharge max capacité min fréquence vibration vide hz amplitude max productivité h spécifications moteur type moteur temps puissance maximale hp rpm déplacement cc système démarrage recoil start carburant essence capacité réservoir carburant litres consommation carburant g h lubrifiez capacité dhuile ml consommation dhuile graissage g h,-0.0564631360878051
Groupe électrogène,165000.0,Plateau Dakar,groupe électrogène fournisseur délectricité,-0.0691970130420185
Tondeuse à gazon automotrice à batterie,300000.0,Ouakam Dakar,tondeuse gazon automotrice batterie sans fil devantv xv charguer double portdurée dexécution jusquà minutestemps charge h batterienécessite piles fonctionner,-0.02008063050433824
feuilles Micro-Cut Shredder manuel d’utilisation,45000.0,Ouakam Dakar,feuilles microcut shredder manuel dutilisationmodèle ccsécurité lentrée facile dalimentation fente inclinée sécurité empêche blessuresdéchiquetez cartes créditpetites pinces papier agrafespoignée levage facileenlèvement déchets,-0.11285601974217874
Bac à Ordures en Plastique 660L,150000.0,Plateau Dakar,bac ordures plastique neuf litrespoint vente plateau keur massar,-0.07465438887953854
