Titre,Prix,Adresse,Description,Prix_scaled
Onduleur Mercury 850 VA Maverick ups,30000.0,Médina Dakar,type interactivepuissance vaonde sortie vitesse dapproximation dune onde sinusodalele temps transfert batterie msle nombre sortie connecteurs dalimentation deux piles type sortie connecteurs dalimentation iec lordinateurentrée sortieentrée tension phasesortie tension phasetension dentrée facteur puissance fonctionnalitésaffichage linformation indicateurs ledalarme sonore ouidémarrage froid ouila protectionprotection surcharge ouiprotection contre impulsions haute tension ouifiltrage bruit ouiprotection courtcircuit ouiinformations supplémentairescouleur noirdimensions lxhxp xx mmpoids kgbuild in avr with wide input range of vacauto restartoutput short circuit protectionoverload protectionovercharge protectionsleek and compact design with cpu control original tout neuf scellé bote garantie an possibilité livraison facture sous h nb prix fixe,-0.11831339557969878
Réfrigérateur,35000.0,Rufisque Dakar,réfrigérateur beko venant vendre,-0.11649427030052542
Pack sanitaire complet,125000.0,Sacré-cœur Dakar,pack complet chaise anglaise mécanismeabattantdouchetterobinet doubleflexible vice fixation lavabopied robinet simple flexible siphonvice fixation miroir simple accessoires douche chasse deau robinet simplele tout prix promo compris livraison gratuite dakar,-0.08375001527540525
Colonne de douche design,1.0,Sacré-cœur Dakar,colonnes douche différents modèles disponibles différents prixplus dinformations veuillez contacter,-0.129227783429683
Snooz pablo boite de sachet de nicotine,10000.0,Ouakam Dakar,plongez expérience rafrachissante pablo xice cold produit innovant redéfinit manière consommer nicotine conçu ngp fabricant renom lunivers sachets nicotine produit distingue force saveur inégalées,-0.12558989669639214
Caméra de surveillance à vendre,60000.0,Avenue Bourguiba Dakar,résolution mp xoffre images claires détaillées idéales lidentification objets visagesvision nocturnedotée technologie infrarouge surveillance continue jour comme nuit portée pouvant atteindre mètres environ pieds permet couverture complète lobscuritéinstallation extérieure intérieureconçue résister conditions climatiques variées idéale utilisation lintérieur comme lextérieurconnectivitécaméra ip signifie quelle peut connecter facilement réseau via cble ethernet wifi selon modèle peut être intégrée système surveillance plus large compatible logiciels tiersdétection mouvementalerte automatique cas mouvement détecté possibilité recevoir notifications temps réel smartphone emailenregistrement flexiblecompatible enregistreurs vidéo réseau nvr options stockage local via carte sd garder vidéos enregistrées toute sécuritéaccès distancevous pouvez consulter images direct accéder vidéos enregistrées via application mobile logiciel pc nimporte où,-0.10739864390465871
Tissu de serre ombriére grillage,1.0,Mbao Dakar,tissu serre ombriére grillage barbar brise vent bonne qualité grand mbao site sipres terminus venant despagne,-0.129227783429683
Bambous Naturel à vendre en détail ou en gros,4500.0,Almadies Dakar,tige bambou disponible vente dakardisponibilité tiges tiges courtes entre tiges longues plus,-0.12759093450348283
Thermomètre numérique avec écran LCD,4000.0,Hann maristes Dakar,santé sans mercure sans souci peut éviter dommages causés verre fragile thermomètre fuites mercure tranquillité desprit protection lenvironnementla conception étanche tête détection température peut être directement frottée désinfectée lalcool leau clairela tête souple silicone tpr qualité médicale sadapte plus confortablement peau bébélaffichage numérique grand écran lcd peut être facilement utilisé personnes gées enfants éviter erreurs lecturela mesure température résistance sonde haute température principalement destinée mesure température aisselles peut mesurer température corporelle équilibrée seulement minutes,-0.12777284703140016
Bac réfrigérés,800000.0,Almadies 2 Dakar,vente bacs réfrigérés capacités,0.16183189741299608
camera de surveillance,,Nord foire Dakar,camera vidéo surveillance,
VENTE ET INSTALLATION DE VIDÉO SURVEILLANCE,1.0,Nord foire Dakar,vente installation vidéo surveillance,-0.129227783429683
lot de 3 mètre ruban  ; possibilité d'acheter 1,6000.0,Hann maristes Dakar,ruban mesurer corps mesure nimporte quelle partie corps bras cuisse mollet poitrine taille hanches etc mesure jusquà cm long parce botier ruban mesurer mesure cm large commençons mesurer cm aider simplifier processus mesurerétraction bouton poussoir fonction verrouillage broches obtenir lectures plus précises plus confortables broche verrouille place pouvez rétracter ruban obtenir meilleures mesures fonction rétraction verrouillage boutonpoussoir garantit mesure appropriée précision supérieuredesign ergonomique portable mini design portable élégant aide lutiliser facilité mesure facile ranger nimporte où commode bureau tiroir salle sportapplication mètre ruban corps a marques larges claires pouces cm idéal couture lartisanat mesures corporelles plus encore cest également cadeau nol parfait,-0.12704519691973082
Des réservoirs d'eau disponibles,90000.0,Pikine Dakar,réservoirs deau disponibles,-0.09648389222961866
Oxymètre de pouls saturomètre Sp02,15000.0,Hann maristes Dakar,lopération simple démarrage bouton débarrassezvous étapes fastidieuses lopérationmettez simplement doigt machine appuyez bouton fonctionnement attendez après quelques secondes connatrez précision niveau spo fréquence poulsselon technologie balayage denregistrement dimpulsions volume technologie détection saturation oxygène photoélectrique adoptée loxymètre pouls peut mesurer saturation oxygène pouls fréquence pouls travers doigts oxymètre pouls portable saturation oxygène sanguin monitor detector sports tensiomètre thermomètre,-0.1237707714172188
Machine à café Expresso,150000.0,Parcelles Assainies Dakar,machine neuve bote dorigine jamais ouverte,-0.07465438887953854
Cliveuse Fibre Optiaue,40000.0,Golf Dakar,coupefibre optique haute précision positions lames lutilisation fttx,-0.11467514502135208
Four une porte ESMACH,3000000.0,Yoff Dakar,mets vente four marque esmachles chariots plateaux offerts,0.962247020249267
Régulateur de tension +/- 20%  15kva à 400kva,450000.0,Rufisque Dakar,régulateur tension kva qualité supérieure celle marché local garantie,0.034493127870862055
Civière dorsale orthopédique,12000.0,Parcelles Assainies Dakar,soulagez douleurs dos cou douleurs dorsales cervicales peuvent devenir handicapantes si elles ignoréescivière dorsale orthopédiqueutilisezla minutes jour soulager douleurs améliorer postureprix francs livraison gratuite dakar,-0.12486224658472281
Niveau Laser BOSCH,110000.0,Yoff Dakar,niveau laser bosch disponible chez sbgvenez profiter promo fin dannée chez sbgprix plus bas,-0.08920739111292528
Bétonnière Electrique 200L,460000.0,Yoff Dakar,bétonnière électrique presque neuf utilisé seule fois essaiestrès adapter maçons carreleurprix wanterrepromo fin dannée chez sbg,0.03813137842920874
Panneau Doka 2m,15000.0,Yoff Dakar,liquidation stock panneau jaune doka mmxxvenez promo fin dannée chez sbgles prix plus baslivraison offerte partir panneaux,-0.1237707714172188
Machine débecquer bec,150000.0,Rufisque Dakar,nouveau chez ets mouhamed traoré filsnouvel arrivage machines débecquer bec poulets oiseauxplus dinformations appeler,-0.07465438887953854
CARREAUX GRÈS POLY 60X120,7900.0,Hann maristes Dakar,carrelage grespoly x qualité supérieure convenable tous espaces sol btiments salon chambres couloir etcnb carreaux grès cerame poly x certifiés,-0.12635392931364495
Imou Cruiser Z 3K 5MP IPC-S7DP-5M0WEZ,65000.0,Plateau Dakar,imou caméra extérieur wifi cruiser z k mp ipcsdpmwezdescription produit nom caméra surveillance marque imou modèle ipcsdpmwez résolution cmos progressif mégapixels mp utilisation extérieur vision nuit oui rotation panoramique inclinaison prise charge microsd jusquà gb cloud storage réseau ethernet wifi alimentation va étanchéité ip fonction micro hautparleur intégrés fonction audio bidirectionnel fonction application imou ios android couleur blanc,-0.10557951862548537
Pack de six rouleaux essuie-tout GARBI XL,12500.0,Plateau Dakar,pack six rouleaux essuietout garbi doté dune grande résistance dune grande capacité dabsorption made in spain,-0.12468033405680547
Béton noir,22.0,Ngoundiane Thiès,constructions maisons particulier coopérative dhabitat assurons livraison continu disposons béton dites juste quantité lieu livraison merci contacter,-0.12922014310351046
Ombriére tissus de serre grillage barbar,1.0,Mbao Dakar,ombriére tissus serre grillage barbar venant despagnelieu grands mbao,-0.129227783429683
Accessoires salle de bain noir/doré/argenté,38000.0,Sacré-cœur Dakar,accessoires douche design différents modèles disponibles différents prix veuillez contacter,-0.11540279513302142
Tissus de serre grillage barbar brise,1.0,Mbao Dakar,tissus serre grillage barbar brise vent got gottous matériaux agricol disponibles wethima group nguirr yombal sén mbay ar sén guathiakh gui venant despagne,-0.129227783429683
"Vente Agglos, hourdis & pavés #dimensions",400.0,Pikine Dakar,bonjournous vendons produits vibrées agglos a a a etcc hourdis h h etc ainsi pavés h bordures autres proposons prix très abordables service transportsi intéressé merci contacter plus détails cordialement,-0.12908261723240497
Hallufix Hallux Valgus,10000.0,Castor Dakar,hallufix hallux valgus attelle correction désalignement gros orteil piècelattelle hallufix hallux valgus a développée scientifiques chirurgiens orthopédistes corriger désalignement gros orteil terme technique hallux valgusil a prouvé cette attelle articulaire corrige désalignement orteils protège soulage zone douloureuse ballon soutient tout pied lors roulementlattelle hallux valgus facile mettre peut être portée gauche droite avantage particulier lattelle hallufix hallux valguscontrairement attelles conventionnelles rigides hallux valgus système breveté dattelle articulaire permet fois mobilité normale pied nuit pendant journée lors marche grce larticulation anatomiquement adaptée hauteur boule mobilité naturelle larticulation métatarsophalangienne gros orteil conservée lors port cette attelle hallux valgus coussin latéral adapté forme lattelle épouse zone sensible plante pied refroidit si nécessaire lattelle hallufix hallux valgus premier choix correction protection cas désalignement gros orteillattelle hallufix hallux valgus coussin latéral gel peut être utilisée corriger désalignement gros orteil pied peut être ramené forme naturelle maintenu laide lattelleattelle hallux valgus correction permanente déformation gros orteillarticulation flexible lattelle maintient mobilité piedsredresser larc transversal amener métatarses position optimalefacile porter chaussures confortablesloreiller gel peut être refroidi réfrigérateurles indications traitement conservateur prophylactique postopératoire lhallux valgusmention légaledemandez médecin pharmacien quels risques effets secondairesinformations produit attelle nuit hallux valgus unilattelle nuit hallux valgus utilisée corriger désalignement gros orteil utilisé titre préventif hallux valgus légers modérés après opération hallux valgus lattelle nuit idéale conserver position corrigée orteils raccourcir période rééducation lattelle doit être portée nuit pied non sollicité peut être utilisée chaussurescaractéristiques lattelle hallufix valgus soutient tout pied lattelle hallufix facile mettre peut être portée gauche droitele matériau respirant améliore climat piedle joint rail flexible permet bouger bandage métatarsien aligne manière optimale métatarsele bandage orteils corrige désalignementlattelle hallufix peut également être portée pendant journée sous tension marchant durée port denviron heures idéale,-0.12558989669639214
UKC SLB-100W LAMP SOLAIRE,23000.0,Castor Dakar,projecteur possède lampe solaire puissante étanche ip entièrement modulable puissance déclairage solaire pouvant être réduitele panneau photovoltaque cristallin collecte lénergie solaire journée stocke batterie lithium intégrée lampe alimenter led projecteur solaire sallume automatiquement tombée nuit grce détecteur crépusculaire mode automatique mode manuel jour nuittype produit eclairage solairemarque ukccontrôleur rfangle lumière faisceau degrésmatériel aluminiumangle lumière faisceau degrésétanchéité ipinstallation facileprix puissance nominale watts puissance nominale watts puissance nominale watts,-0.12086017097054146
Minerve pour douleurs de cou,7000.0,Castor Dakar,minerve douleurs cou bien dormir collier cervical mousse souple douleurs cervicales soutien soulage pression colonne vertébrale enveloppes universelles maintiennent vertèbres stables soulager pression colonne cervicaleminerve coller douleurs cervicales soutien femmes hommesminerve douleurs coula minerve favorise posture plus droite soulage stressidéal employés bureau ceux doivent limiter mouvements cou après intervention chirurgicalefournit soutien cas cou douloureux enflammé nerfs pincés dentorses cervicales myélopathiecivière coucol douxcollier cervical minerve douleurs soutien counotre minerve soutient mchoire cou protège cou réduire douleur pression colonne cervicale réduire pression nerveuse corriger posture assise douleurs articulaires réduire fatigue physique cette minerve peut être utilisée thérapie domicile lautochiropratique correction posture létirement cou aidez tour cou aligner stabiliser vertèbres après blessure prévenir dautres blessurescollier cervicalchaque détail reflète lintention concepteurcivière cousoutien couidéal utilisation pendant travail lecture voyages sommeil conduite jeux protégez colonne cervicale tout moment tout lieudétails soutien cou soulager douleur minerve soutient mchoire cou tout limitant mobilité aider soulager douleur pression colonne cervicale stabilise vertèbres favorise récupération après intervention chirurgicale blessures cou aide améliorer posture cou fatigue coucourbe v ergonomique létireur cou a forme v biseautée près mchoire tout diminuant progressivement épaisseur ajustement plus ergonomique courbes progressivement montantes deux côtés sadapteront soutiendront plus parfaitement cou amélioreront confort portdoux respirant collier fabriqué mousse éponge haute élasticité haute qualité panneau pp offre soutien élevé comporte nombreux trous perméabilité lair lintérieur plus légèreté respirabilité doux peau afin puissiez sentir laise lors dune utilisation continue aider garder cou fraisconception remplacement reposenuque livré manchon amovible tissu soie glacée peut être nettoyé désinfecté simple lavage pouvez lutiliser famille sans soucier sueur fuméetaille réglable conception bande adhésive permet dajuster longueur minerve selon besoins obtenant facilement ajustements précis personnalisés éviter douleur causée balancementcaractéristiques type produit minerve cervicalutilisations spécifiques soutien postchirurgicalfermeté douxutiliser coutranche dge adultecouleur grismatériel polyester spandexmatériau remplissage polyuréthaneune fonction spéciale ajustableinstructions dentretien produit lavage main seulement,-0.12668137186389614
Mini GPS Tracker GF07 magnétique - Localisation GPS,15000.0,Castor Dakar,mini tracker gps mettre sac enfants véhicule moto vélo animal domestique personne gé localiser tout momentpas besoin connexion internetlocalisation écoute temps réelmini gps tracker gf magnétique petit jusquà jours dutilisationpetite taille utilisation carte sim gps jusquà jours dutilisationmini gps tracker gf magnetic nouveau concept permettre savoir où trouvent proches particulièrement adapté personnes gées enfants conçu être utilisé carte sim afin savoir où trouvent tout momentgrce très petite taille peut être facilement transporté pocheil conçu batterie grande qualité grande capacité permet dêtre utilisé jusquà jours fonction gps jusquà jours veillece nouveau mini gps tracker gf magnetic solution parfaite personnes gées enfants garantie ans meilleur service clientavantages mini gps tracker gf magneticde très petite taille peut être transporté toutes personnesavec carte sim permet téléphoner grce cette cartegps étanche haute précisioncomment configurer tracker mini insérez carte sim gps sallumera automatiquementdepuis smartphone envoyez message numéro téléphone carte sim texte alors relierez gps téléphoneattendez quelques secondes recevrez message confirmation dassociationsi souhaitez obtenir position gps lien google maps pourcentage batterie envoyez message numéro gps texte recevrez message lemplacement batteriecomme ça idem si voulez parler personne pouvez appeler numéro téléphone traceur entendrez voix lautre personnemême fonction daide sos dune simple pression bouton pouvez envoyer appel message détressetype produit mini traceurmodèle gffonction gps positionnementétanchenorme réseau gsmgprspositionnement gsm bande fréquences gsm mhzutiliser carte simdurée lappel minutescarte dextension carte mini sdprécision positionnement gps mdimensions x x cmpoids grtype batterie polymêretaille batterie v mahtension travail v dcentrée charge acv hzsortie charge dc v mahtemps dutilisatio jourstemps dattente jours,-0.1237707714172188
Flacon de 10ml d'e-liquide pour cigarette électronique,3000.0,Diamaguene Dakar,flacon ml deliquide cigarette électronique,-0.1281366720872348
Porte,65000.0,Mbao Dakar,vendons portes neufs très bonne qualité prix abordablechambre cuisine toilettes,-0.10557951862548537
Porte sans cadre,35000.0,Mbao Dakar,porte nue sans cadre,-0.11649427030052542
Porte d'entrée,160000.0,Mbao Dakar,porte blindée points fermeture,-0.07101613832119184
Flacon de 50ml d'e-liquide pour cigarette électronique,10000.0,Diamaguene Dakar,vendons flacon ml deliquide cigarette électronique disponible plusieurs gout made in france,-0.12558989669639214
Flacon 100ml d'e-liquide pour cigarette électronique,15000.0,Diamaguene Dakar,vendons flacon ml deliquide cigarettes électroniques disponibles plusieurs gout venant france,-0.1237707714172188
Puff 15000 coups fumot r and m tornado,14000.0,Ouakam Dakar,vendons puff coups disponibles plusieurs gout,-0.12413459647305347
Cigarette électronique rechargeable gtx 40watt,25000.0,Ouakam Dakar,kit gtx go vaporesso offre combinaison dune cigarette électronique facile démonter remplir recharger dun équipement dédié vapoteurs commencent oublier leurs anciennes habitudes fumeur résistance ohm fournie permet réglage doffice watts dispositif accueille résistances compatibles gtx v mesh partir ohm vape plus puissante abondante accentuée lairflow plutôt aérien situé base cartouche,-0.12013252085887212
grillage,,Plateau Dakar,khelcome business offre clôtures grillages air jeux rigide grillage pvc grille clôture tendeur fil tendeur galva fil tension poteau piquet jambe force poteau tension piquet tension barbelés sécurité maisons entreprises terrains champs autres service pose livraison disponible,
tole pvc tuile bac aluzinc ardoise zinc,,Plateau Dakar,khelcome business offre toitures couverture tole bac acier ondule tole pvc tole tuile bac tuile plastique panneau tuile plaque pvc imitation tuile tôle imitation tuile auvent fenêtre auvent terrasse auvent jardin bac zinc alu tuile métallique bac tuile ondiculaire zinc bac plastique ardoise plastique ardoise fibrociment etc tout accessoire poutrelle fer bois crochet fixateur,
4 Caméras + DVR + 4 CABLES,65000.0,Dieuppeul Dakar,kit caméras mp dvr ports rouleaux cbles mvous pouvez visionner vidéos via téléphone pcgarantie mois,-0.10557951862548537
Machine à coudre IMPEC,250000.0,Liberte 6 extension Dakar,machine coudre impecachetée neuve jamais utilisée vendre,-0.038271883296071674
Masque et lunette de sécurité,1.0,Guediawaye Dakar,masque lunette sécurité,-0.129227783429683
RECHERCHE BOX CENTRE D'APPEL,,Liberte 6 extension Dakar,ensemble bureau collectif lequel différents postes séparés cloisons,
Echafaudage de façade,2500.0,Almadies Dakar,echafaudages galvanisés assure robustesse durabilité facile monter démonter léchafaudage lié façade amarrages fixation doté plateformes antidérapantes gardecorpprix mou niveaumatériau acierrevêtement galvanisédimension dun bloc hauteur mlargeur,-0.12831858461515216
Réfrigérateur à boissons,350000.0,Avenue Bourguiba Dakar,bonjour vends réfrigérateur doccasions venant france révisé gaz tout nécessaire fait,-0.001889377712604809
Ensemble chaise et lavabo,88000.0,Parcelles Assainies Dakar,spécial cadeaux chez boutique batimadécodes ensembles chaises anglaises lavabo mécanisme abattant tous accessoires siphon lavabo flexible boulons fixations robinet disposition prêt poseravec boutique batimadeco satisfaction client challenge quotidien,-0.097211542341288
Chaise anglaise avec leur lavabo suspendu,188000.0,Parcelles Assainies Dakar,wc lavabo style décor disponibles prix imbattables,-0.06082903675782113
Ensemble chaise anglaise grand modèle,149000.0,Parcelles Assainies Dakar,ensembles chaises anglaises wc lavabo disponibles bon prix possible livraison,-0.07501821393537321
Échelle,1.0,Sacré-cœur Dakar,mets vente échelle coulissante mètres normes européennes,-0.129227783429683
camera de video surveillance,,Nord foire Dakar,vente installation video surveillance,
camera de video surveillance,,Nord foire Dakar,vente installation video surveillance,
kit 8 caméra + Dvr et câble,100000.0,Liberte 6 extension Dakar,kit caméras dvr cbles inclus surveillance complète hd installation facile sécurité renforcée parfait protéger espaces découvrezle ici,-0.09284564167127196
kit 4 caméra + Dvr et 4 câble,65000.0,Liberte 6 extension Dakar,kit caméras dvr cbles inclus solution complète surveillance efficace installation simple qualité hd sécurité optimale,-0.10557951862548537
Dvr dcl 8 port,30000.0,Liberte 6 extension Dakar,découvrez dvr ports solution idéale surveiller sécuriser espaces performances fiables installation facile compatibilité caméras,-0.11831339557969878
Groupe Pramac 65 kva,7000000.0,Plateau Dakar,moteur deutz alternateur standard heures marche entretien complet,2.4175472435879417
Déambulateur - Béquilles anglaises,53000.0,Hann maristes Dakar,aidez proches a retrouver mobilité après blessure maladie vieillesse outils aident grandement a tenir debout déplacer a maison dehorsvendu a lunitédéambulateur chaise fatigué sassoie haut gamme roues pliable démontable rangement facile lors déplacementsbéquilles sous aisselles avant bras avant bras kdéambulateur pliable roues klivraison possible,-0.10994541929550139
camera de vidéo surveillance,,Nord foire Dakar,vente installation vidéo surveillance,
Drap de consultation jetable imperméable à l'eau,15000.0,Thiès Thiès,dimensions cmquantité draps rouleaucouleurs blanche bleue rosedescription draps lit jetables non tissés adaptés lindustrie beauté traitement médical massage spa spa dautres scènes différentes respirants doux sains confortables propres hygiéniques facile transporter portabledoux luxueux confortableces clients qualité spa utilisent draps jetables visage cheveux corps dautres supports dabsorption deau obtenir meilleure polyvalencelibérer temps précieux clientsaider employés accorder plus dattention besoins clients formation servicesgagnez temps largentparfait spas salons salons coiffure centres villégiature luxe cette feuille jetable hypoallergénique peut réduire nettoyage exigences budgétaires globaleséconomisez lefficacité lespaceles draps uniques invités conviennent mieux propriétaires dentreprises particuliers souhaitent quitter lespace précieux sol nécessaire léquipement service blanchisserie,-0.1237707714172188
silicones,900.0,Thiès Thiès,silicones qualiter a vendre gros blanc noire trsnsparants,-0.12890070470448764
Brimo,200000.0,Plateau Dakar,motor electric,-0.0564631360878051
Plaque Induction Bosch,320000.0,Saly Portudal Thiès,plaque induction marque bosch tres bon etat,-0.012804129387644868
Porte double battants antibruit pvc,128000.0,Nord foire Dakar,portes deux ouvrants pvc double battants double vitrage quasi blindée étanche isolante thermique phonique confort sécurité garantie cas fermeture idéales bordure marine routièrenous nord foire face brioche doree,-0.08265854010790125
Porte bois avec cadre,48000.0,Nord foire Dakar,porte bois cadre disponible nord foire face brioche doree,-0.11176454457467473
Porte toilette pvc antibruit double vitrage,65000.0,Nord foire Dakar,porte toilette pvc double vitrage antibruit disponible nord foire face brioche doree,-0.10557951862548537
Câble anti-feu CR1 2 x 1.5MM ORANGE,800.0,Liberte 6 extension Dakar,découvrez cble antifeu cr xmm orange haute sécurité résistance feu idéal installations électriques fiables commandez dès maintenant,-0.1289370872100711
Caméra ip hikvision 2mp,25000.0,Liberte 6 extension Dakar,découvrez caméra ip hikvision mp surveillance haute définition vision nocturne performance fiable idéal sécuriser espaces achetez maintenant,-0.12013252085887212
Caméra hikvision ip  2mp,35000.0,Liberte 6 extension Dakar,découvrez caméra ip hikvision dôme fixe mp ir imagerie haute qualité résolution mp technologie compression h efficace,-0.11649427030052542
TUILS DE TOITURE ITALIEN,1.0,Parcelles Assainies Dakar,tuil toiture italien premier choix solide pratique différentes dimensions disponible boutique,-0.129227783429683
