Titre,Prix,Adresse,Description,Prix_scaled
Lot de 10 portes badges transparents,5000.0,Almadies Dakar,taille xxmmmatériel plastique durcouleur porte badge translucide clairinsertion carte horizontalutilisation carte demployé carte crédit carte didentité carte visiteur etccouleurs cordons vert rouge bleudétails demballage piècespaquetlivraison offerte partir paquetspoints forts robustelégeresthétiquepolyvalent,-0.12740902197556547
Groupe électrogène silencieux 150kva,15.0,Hann maristes Dakar,bonjour stocks ge silencieux norme européenne kva kva neuf disponible stocksveuillez contacter plus dinformations fiche technique disponible,-0.12922268987890131
Groupe électrogène super silencieux,1200.0,Hann maristes Dakar,kva super silencieux disponible prix compétitifs marcher service après vente efficace garantie moteur adaptée toute sorte température ambiante,-0.12879155718773722
Gps voiture Sinotrack st 901,27000.0,Avenue Bourguiba Dakar,traqueur gps étanchemini taille facile cacherdétection acc alarme acccouper moteur distance prend charge cble pin relaisalarme mise hors tension principale batterie uniquementalarme géoclôture alarme survitessepour véhiculemotoscooterantenne gps gsm haute sensibilité intégréegpsgprsgsmsms positionnement suivisuivi sms téléphone portable lien google mapsapplication ios android,-0.11940487074720278
Tout pour équipée vos salle d eau,10.0,Noflaye Dakar,proche habitants cité cdc bambilor habitants sangalkam cité noflaykeur ndiaye lo environtout salle bain robinet accessoirescuisine équipée,-0.12922450900418048
Débroussailleuse,150000.0,Parcelles Assainies Dakar,débroussailleuse mauvaises herbes entretien jardin type ergonomique poignée lopération faciletype déclencheur commutateur fonction darrêtqualité fiable dia mm tuyau principal aluminiumavec larbre dentranement acier solide mm débroussailleuseensemble dembrayage durable cas dengrenagegardien sécurité qualifié protéger lopérateuréquipé moteurs débroussailleuse mitsubishi dorigineavec divers type harnais,-0.07465438887953854
Pèse-personne  intelligente,8500.0,Médina Dakar,pèse personne balance pesée intelligente bluetooth balance électronique intelligente perte poidstrès précise affiche lheure vitesse calories brlées très précisesbluetooth équipé dun microphone dun écran lcd clair lecture facile pourrez lire musique lenregistrement maison bureau piquenique plage si douche pleine délasticitédécor design moderne panneau acrylique transparent rendent élégant facile utiliser conception plaque dacier ultramince forme u sintègre nimporte quel style moderne décoration existant,-0.12613563428014415
Machine Compteuse Detecteuse de Billet,,Parcelles Assainies Dakar,machine compteuse detecteuse faux billets,
grillage,,Plateau Dakar,khelcome business offre clôtures grillages air jeux rigide grillage pvc grille clôture tendeur fil tendeur galva fil tension poteau piquet jambe force poteau tension piquet tension barbelés sécurité maisons entreprises terrains champs autres service pose livraison disponible,
DISQUE DUR POUR CAMERA DE SURVEILLANCE 2 TERA,40000.0,Rufisque Dakar,disque dur camera surveillance terapeut prendre jusquà caméras,-0.11467514502135208
Balance électronique 300kilo,45000.0,Parcelles Assainies Dakar,balance électronique capacité jusquà kg original tout neuf scellé bote prix imbattable promotionnel garantie possibilité livraison facture sous h nb prix fixe,-0.11285601974217874
Jumelle 80x80,1.0,Plateau Dakar,jumelle x,-0.129227783429683
Plaqueuse de chant,11000000.0,Cambérène Dakar,a vendre cette plaqueuse fabriqué italie scm k vendons cause double emploi possibilité lessayer place pièces rechange disponible,3.872847466926616
lampe solaire puissante avec détecteur de mouvement,20000.0,Mermoz Dakar,lampe solaire watts détection mouvement waterproof vendre a mermoz télécommande barre fer venant usa,-0.12195164613804546
Caméra de surveillance PTZ 2k/4MP,35000.0,Thiaroye Dakar,système caméra double objectif mm mm zoom hybride xrésolution mp objectif mp mpprend charge wifi g peut prendre charge connexion filairestrong textprise charge détection mouvement humanode aivision nocturne ir vision nocturne couleurtechnologie intelligente pp plug and playnotification push iphoneandroid appprise charge vue multiutilisateurs partage dautrestransmission dimages temps réel réseau adaptatifantenne dbi conception gain élevé forte stablepanoramique inclinaison rotation horizontalement verticalement,-0.11649427030052542
"Spéciale monte charge yall 1,5 t",285000.0,Parcelles Assainies Dakar,travaillez rapidement surtout efficacité grce cette puissante machine dotée système électronique très efficace meilleure rapport autres hésitez donc appeler,-0.02553800634185827
Puissant régulateur Sako triphasé ( 30 kva; 15 kva ...),585000.0,Parcelles Assainies Dakar,responsable entreprise ratez surtout cette spéciale offre a moins désirez certainement installer chez protéger circuit suffit juste appeler,0.08360951040854232
PANO DE DÉCORATION,20000.0,Parcelles Assainies Dakar,pano décoration plaque marbre pvc mxm pratique finition maisondisponible boutiquepour plus produits veuillez visiter shoowroom wwwexpatdakarcom,-0.12195164613804546
Disjoncteur moteur,35000.0,Pikine Dakar,disjoncteur moteur industriellegvp schneider,-0.11649427030052542
Cartes d'entrées analogiques  Schneider,250000.0,Pikine Dakar,carte schneider tsxaeyoccasion neuf scellé entrées analogiques courantquantité disponibleprix a a débattre,-0.038271883296071674
Peinture de 1 er qualité,60000.0,Sicap foire Dakar,peinture acrylique finition blanc matpour protection décoration murs plafonds intérieursrendement couche litresec toucher h sec recouvrable hpeinture murs plafonds tollens blanc intérieurmat lmurs plafonds boiseries,-0.10739864390465871
Perceuse portative bosch 88v,75000.0,Parcelles Assainies Dakar,travaillez rapidement surtout partout où voulez tel but cette mignonne perceuseelle toute neuve hésitez donc appeler,-0.10194126806713869
Demolission Hammer 3400w,145000.0,Parcelles Assainies Dakar,w peuvent égalerpour tout dire aucune matière résiste plus dur bétons hésitez donc appeler tout neuf accompagné puissants brins,-0.07647351415871188
Gonfleur et chargeur de batterie,98500.0,Parcelles Assainies Dakar,fini tous soucis gonfleur évidemment éviterez tout désagréments jusquà bars juste minutes hésitez donc appeler tout neuf,-0.09339137925502397
Puissante défonceuse bosch,68000.0,Parcelles Assainies Dakar,défonceuse outil électrique pneumatique utilisé réaliser rainures bordures profilages bois dautres matériaux fonctionne faisant tourner fraise grande vitesse permettant façonner matériau manière précise cest outil essentiel travaux menuiseried ailleurs dispose hésitez donc appeler,-0.10448804345798136
"Machine Transformation de Noix de Cajou, decortiquer",1500000.0,Fatick Fatick,proposons machines transformation noix cajou cellesci faciles utiliser rendement dune machine heure denviron kg noix brutesen bon état doccasionprix unitaire départ site,0.4165094364972641
Billard occasion,375000.0,Almadies Dakar,table billard ft accessoires occasion billard américan jeu billard ft table billard mesa billar verttable billard modèle saison verte robuste résistante objet neuf emballé professionnelle dimensions réglementairesles dimensions table professionnelles pieds dimensions jeu cm x cm élégante idéale aussi salles bureaux comme meuble dembellissement table billard professionnelle couleur marron foncé drap bleu angles chromés idéale soirées compagnie amis dimensions paquet bote cmx cm x cm poids spécifications techniques couleur marron foncé drap verte dimensions pieds dimensions jeu cm x cm poids kg dimensions cm longueur x cm largeur x cm hauteur diamètre blouses cmcomme photo montage facile rapide,0.007206248683261906
Niveleuse vibrante pour surface.,1250000.0,Diamniadio Dakar,niveleuse vibrante surface bétonneuf,0.32555317253859695
Seau coulage béton,1000000.0,Diamniadio Dakar,seau coulage béton,0.2345969085799298
L'évier de cuisine en acier inoxydable,,Parcelles Assainies Dakar,faites lexpérience dun nettoyage vaisselle dynamique deux robinets cascade angle réglable robinet extractible polyvalent offrant plusieurs modes deauaméliorez hydratation robinet purificateur deau purificateur deau non inclus dessus eau potable qualité supérieurele traitement révolutionnaire nano revêtement résiste taches deau dhuile garantissant durabilité durabletournez bouton commande vidange stockage drainage leau sans effort éliminant ainsi besoin retirez couvercle drain manuellementlaffichage température verre trempé ajoute sophistication durabilité cuisineaffichage numérique température temps réel sans batterie nettoyage précis température plus appropriéeaméliorez lefficacité panier drainage plateau métal planche découper double face inclusoptimisez lespace travail stockage grce conception drain décalé améliorez cuisine sans effortune planche découper double face aide empêcher saveurs mélanger pendant préparez nimporte quoi viandes légumes passant fruitsaméliorez sans effort cuisine cette planche pouces pouces évier grande taille poucescommander vite évier chez aad suarl,
Robinet bassin,,Parcelles Assainies Dakar,montage support fixation rapide raccord type expansion similaire ancrage muralrobinet bassin disponible chez aad suarl,
"Machine pour Poudre de Baobab, Bouye, Pain de singe",3500000.0,Fatick Fatick,proposons machine tambour baobab vente soustraitance sépare poudre baobab grainesdeux tamis grossier finmatériau acier inoxydablerendement env kg matière première heurela machine peut être visitéeprix francs,1.1441595481666014
Colonne de douche thermostatique,,Parcelles Assainies Dakar,robinet bain douche robinet bain ensemble douche laiton douche dôme douche supérieure douche jet panoramique robinet pistoletthermostat haute qualité thermostat précis empêche manière fiable leau devenir trop chaude trop froide garantissant température leau reste antigel antibrlure offrant expérience bain parfaite confortable laiton qualité supérieure verre trempé augmentent durabilitésystème douche complet linverseur adopte conception innovante touches piano quatre fonctions sortie deau fonctionnent indépendamment elles clairement marquées difficiles toucher accidentellement plus linverseur boutonpoussoir agit également comme commande coupure deau temporaire signifie navez besoin dajuster poignée chaque fois couper leau garder chaudexpérience douche effet pluie grand jet supérieur mm offre débit deau luxueux pression deau plus élevée sorties deau uniformément réparties débit deau confortable entoure tout corps massant peau soulageant fatigue ouvrant nouveau monde douche buse silicone facile nettoyer dépôts tartre éviter colmatagedouche flexible douchette main dispose modes tuyau douche mètre long offre flexibilité maximale aider nettoyer nimporte où idéal douches enfantspersonnes gées soins personnes gées douches animaux compagnie applications nettoyage salle bain plus encorerobinet baignoire cascade robinet baignoire cascade caché peut rapidement remplir baignoire débit deau doux sans éclaboussures robinets équipés daérateurs filtrent impuretés leau conception panneau principal grand plat peut accueillir divers articles toilette économiser lespaceréglable hauteur langle douche tête douchette main peuvent être ajustés répondre différents besoins douche douchette main peut être réglée bouton coulissant utilisation facile si tringle douche nest assez longue veuillez contacter enverrons tringle douche supplémentairegarantie support technique professionnelles marque professionnelle salle bain dédiée fournir clients produits salle bain plus haute qualité si questions produit problèmes qualité produit après lachat nhésitez contacter donnerons certainement solution plus satisfaisante,
cuvette de toilette luxe,,Parcelles Assainies Dakar,articles sanitaires luxe placard eau céramique ligne dorée conception one piece p trap wc cuvette toilette salle baindisponible chez aad suarl,
Débitmètre électromagnétique,2.0,Somone Thiès,utilisation process industries agroalimentaire chimiques mines minerais ptes papiers traitement eaux eaux usées httpsfrkrohnecomfrproduitsmesurededebitdebimetresdebitmetreselectromagnetiquesoptifluxplus détail prix a contacter mailcdt,-0.12922741960462716
Raclette vinyle en plastique,3000.0,Mbao Dakar,raclette vinyle plastique souple branding pause vinyle,-0.1281366720872348
Détecteur de mouvements Pir,15000.0,Liberte 6 Dakar,deux détecteurs mouvements neuf marque pir vider,-0.1237707714172188
Baignoire avec luminothérapie,,Parcelles Assainies Dakar,quincaillerie aad solution parfaite vousle design élégant sadapte toutes ambiances salle bainsfinition haute qualité cadre extra renforcétoutes fonctions peuvent être contrôlées via élément commande écran tactile moderneincl luminothérapie chauffage radio bien plus encore,
Douche à vapeur,,Parcelles Assainies Dakar,aad suarl toujours bon choix douche vapeursi recherchez produit laisse rien désirer sadapte néanmoins petites salles bains cette cabine douche vapeur solution parfaite vousune utilisation normale douchette main réglable laide barre douche fournie également possible design moderne associé bonne fonctionnalité complète bestseller détendez bain remous sous lumière apaisante led intégrées panneau central détendez sous pluie tropicale chaude évacuez stress bain vapeur option également arôme parfumé système désinfection lozone intégré garantit nettoyage sans résidus respectueux lenvironnement siège enfermé baignoire structure antidérapante fond baignoire garantissent utilisation toute sécurité massage pieds intégré thérapie réflexologie détendue jets massage dos intégrés panneau central derrière siège massant dos rendent lexpérience relaxation parfaite non seulement fonctionnalités exceptionnelles qualité également plus juste prix indiqué,
Meuble salle de bain avec miroir,300000.0,Sacré-cœur Dakar,disponibilité stock,-0.02008063050433824
Sac 3 pièces,1.0,Pikine Dakar,bonjour expat vendons sacs pièces bonne qualité,-0.129227783429683
GARMIN GPS OVERLANDER,400000.0,Médina Dakar,vends gamins gps comme gamins gps overlander multiples systèmes pouces guidage vocal waypoint solide très polyvalent vends aussi garmin gps garmin montana i simple garmin etrexx être garmin gps aussi petits bateaux aussi tout toute neuf,0.01630187507912862
PAPIER A4 HYBRITE 80 grs,3150.0,Plateau Dakar,ramette feuillesformat agrammage gcouleur blanche,-0.1280820983288596
RAMPES ESCALIERS,1.0,Grand-Yoff Dakar,vendons rampes escaliers innox neuves made in sénégal,-0.129227783429683
PORTE EN BOIS,1.0,Grand-Yoff Dakar,vendons portes bois plein laminées originales cadre montage neuves made in sénégal,-0.129227783429683
PORTE EN INNOX,1.0,Grand-Yoff Dakar,vendons portes innox aluminium verre décor tôle décor coulissante neuves made in sénégal,-0.129227783429683
BALCON EN VERRE,1.0,Grand-Yoff Dakar,vendons balcons verre neufs made in sénégal,-0.129227783429683
BALCON EN INNOX,1.0,Grand-Yoff Dakar,vendons balcons innox made in sénégal,-0.129227783429683
GRILLES EN INNOX,1.0,Grand-Yoff Dakar,vendons grilles innox made in sénégal,-0.129227783429683
MUR RIDEAU,1.0,Grand-Yoff Dakar,vendons murs rideaux neufs madevin sénégal,-0.129227783429683
Colonne de douche ou chasse d'eau,1.0,Sacré-cœur Dakar,colonnes douche chasse deau différents modèles disponibles différents prix,-0.129227783429683
Camera IP rechargeable sans fil sans installation,49000.0,Sacré-cœur Dakar,caméra batterie mp caméra surveillance haute qualité conçue offrir surveillance efficace facile utiliser sans fil voici aperçu principales caractéristiques avantages modèle résolution haute définitionmp résolution mégapixels permet capturer images très détaillées nettes cela particulièrement utile identifier personnes lire plaques dimmatriculation rechargeable sans filla caméra dispose dune batterie intégrée tient semaines nécessite dinstallation cble possible prendre panneaux solaires rechargervision nocturnevision nocturne grce led infrarouges imou cruiser assure visibilité claire conditions faible éclairage lobscurité totale détection mouvement alertedétection intelligente caméra équipée capteurs mouvement intelligents détectent mouvements suspects déclenchent alertes temps réel cela aide réagir rapidement cas dincidents audio bidirectionnelmicrophone hautparleur intégrés fonction audio bidirectionnelle permet non seulement écouter sons zone surveillée aussi parler travers caméra peut être utile communiquer visiteurs dissuader intrus stockage accèsstockage carte sd caméra prend charge cartes microsd stockage local permet conserver enregistrements sans avoir besoin dun serveur externeaccès distance grce application mobile conviviale pouvez visualiser images temps réel accéder enregistrements gérer paramètres caméra depuis nimporte où résistance intempériesconstruction robuste conçue résister conditions climatiques difficiles rend adaptée utilisation extérieur installation configuration facilesinstallation simplifiée caméra conçue installation facile support instructions clairs mise place rapide compatibilité intégrationintégration systèmes sécurité peut être intégrée dautres systèmes sécurité domestique solution complète,-0.11140071951884006
VIDÉOPROJECTEUR ANDROID WIFI,175000.0,Yoff Dakar,vidéoprojecteur android wifioptez vidéoprojecteur android wifi portable toute bis réunions home cinéma sortie famille aussi établissement projections hautes résolutions,-0.06555876248367182
Alarme de sécurité connecté pour porte/fenêtre/garage,25000.0,Sacré-cœur Dakar,alarm protéger maison bureau appartement boutique appareil connecté téléphone smart possibilité programmer alarme protégé cher alarme sécurité,-0.12013252085887212
Broyeur mil en inox agro-alimentaire,3000000.0,Fatick Fatick,broyeur inox agroalimentaire,0.962247020249267
Lampe anti Moustique,3500.0,Parcelles Assainies Dakar,lampes antimoustiques dispositifs conçus attirer éliminer moustiques autres insectes volants nuisibles elles utilisent généralement lumière ultraviolette uv led attirer insectes car derniers naturellement attirés certaines longueurs donde lumineuses fois moustiques sapprochent lampe éliminés système électrique grille électrifiée capturés ventilateur aspirant réservoirces lampes idéales utilisation intérieur comme extérieur elles écologiques car elles nutilisent produits chimiques ni pesticides souvent silencieuses certaines modèles également équipés dispositifs supplémentaires comme capteurs mouvement miniventilateurs optimiser efficacité faciles entretenir elles constituent solution pratique éloigner moustiques surtout lors soirées dété,-0.12795475955931748
Tronçonneuse électrique remington,50000.0,Hann maristes Dakar,vend tronçonneuse électrique marque remington,-0.1110368944630054
Sacs sous vide gaufrés 100 pièces,7000.0,Médina Dakar,gardez aliments frais jusquà x fois plus longtemps sacs sous vide gaufré sachets sous vide accessoires servent emprisonner aliments objets fragiles vide dair total but daugmenter considérablement leurs durées conservation associés machine sous vide faciles dutilisation extrêmement rentables,-0.12668137186389614
Mac 💻 book Pro Gris,240.0,Ouakam Dakar,ordinateur bon état gigas tout reste completwha,-0.12914082924133852
Portes toilette pvc,75000.0,Nord foire Dakar,portes toilette pvc disponibles nord foire face brioche doree,-0.10194126806713869
Porte double battants antibruits,135000.0,Nord foire Dakar,portes deux ouvrants pvc double battants double vitrage quasi blindée étanche isolante thermique phonique confort sécurité garantie cas fermeture idéales bordure marine routièrenous nord foire face brioche doree,-0.08011176471705857
Machine glaçon,150000.0,Sicap foire Dakar,mets vente machines glaçons toute neufs,-0.07465438887953854
Compresseur d´air industriel 10Bar 22kw Set complet,6500000.0,Fatick Fatick,proposons vente ensemble composé dun compresseur industriel vis dun réservoir dun sécheur marque empireil distingue caractéristiques suivantes marque empire compressor industriesmodèle ecidpuissance kwair minétat neufvous voyez modèle action recevrez modèle original létat neuf disponible rapidementpour plus amples informations veuillez consulter plaque signalétiqueprix ht stock,2.2356347156706073
Mass hydrau,45000.0,Parcelles Assainies Dakar,bonjour vendons modules groupe electrogene techniciens très exprementé montage,-0.11285601974217874
Glaciere 5 pieces,50000.0,Plateau Dakar,glacière pcs bonne qualité sorties famille collègues très efficace satisfaction client garantie,-0.1110368944630054
Portail en fer+Serrure intelligente,1.0,Sacré-cœur Dakar,portail fer serrure intelligente carte design robusteen panneau den tôle découper plexy double protection sécurité garantie taille standard porte dentrée porte coulissante garage nb commande délais livraison jours,-0.129227783429683
Coffre-fort,,Patte d‘oie Dakar,coffrefort kg kg kg kg kg kg kg disponible chez daraa dji business,
Tapis Fitness Électrique avec Ecran,,Ouest foire Dakar,tapis fitness électrique ecran sport,
Table de Massage Professionnelle Pliable,,Patte d‘oie Dakar,table massage professionnelle pliable disponible chez dara dji businesslivraison montage gratuite,
tampon regard grille caniveau égout assainissement,,Plateau Dakar,khelcome business offre couvercles égouts plaques égouts tampons regards grilles avaloir grille caniveau égout assainissement livraison disponible,
grillage,,Plateau Dakar,khelcome business offre clôtures grillages air jeux rigide grillage pvc grille clôture tendeur fil tendeur galva fil tension poteau piquet jambe force poteau tension piquet tension barbelés sécurité maisons entreprises terrains champs autres service pose livraison disponible,
Fauteuil dentiste,1.0,Hann maristes Dakar,salam fauteuil dentiste vendre prix intéressant,-0.129227783429683
Canne anglaise - Béquille de coudes,27000.0,Hann maristes Dakar,béquille coudes universelle taille réglable positions coudières amovibles permet dutiliser lamainsans séparer béquillelivraison possible,-0.11940487074720278
CARREAUX SOL 69X120,,Hann maristes Dakar,céramica offre carreaux x grès poly prix défiant toute concurrence satisfaction prioriténhesistez passer commande,
CARREAUX SOL 60 X 120,,Hann maristes Dakar,ceramica offre large choix carreaux x grès poly prix dèfiant toute concurancela satisfaction prioritènhesistez passer commande,
Film Vitrage Adhésifs,,Hann maristes Dakar,film vitrage adhésifsfilm décoratiffilm antichaleurfilm opaquefilm teintéfilm anti brisures vitrefilm sécurité vitre,
CARREAUX,,Keur Massar Dakar,vends carreaux dimensions différentes éclat mat salons cuisines chambres salon escaliers couloirspour plus dinformations veuillez contacter,
CARREAUX,,Keur Massar Dakar,vends carreaux tout genre idéal salons chambres couloirs maison cuisines escaliersmerci contacter plus dinformations,
Vente Marbre Beige Nervuré,32000.0,Mbour Thiès,important stock marbre créma marfil beige nervuré venant despagne plaques xcm cm dépaisseur apportez touche luxe revêtements sols murs maison mosquée hôtel prix mettre carré défiant toute concurrence,-0.11758574546802943
COLLE DOUBLE FACE,3500.0,Mamelles Dakar,colle double face très efficace pratique disponible,-0.12795475955931748
Matériel fast food,,Plateau Dakar,proposons matériel fast food plaque burgermachine chawarmafriteusebain marietacosfour pizza,
"Onduleur online, routeurs, commutateurs, serveurs, stockages",200200.0,Parcelles Assainies Dakar,bonjour besoins onduleur online routeurs commutateurs serveurs stockageveuillez contacter établir devis proposons prix revendeursonduleur ligne tour invt série ht kva v v vla série ht onduleur double conversion ligne technologie contrôle dsp complète facteur puissance dentrée sortie élevé fréquence sortie réglage automatique gestion réseau ht choix parfait ordinateurs équipements télécommunicationidc internet data center réseau serveurs système contrôle système communication bureau autres appareils sensibles v v vcaractéristiques vainvt htscapacité kvaphase entrée monophasée sortie monophaséetension dentrée vacvac charge vac charge vac charge vac charge vacpf dentrée fréquence dentrée hz hzpf sortie tension sortie v v vrégulation tension thdu thd charge linéaire thd non linéairerapport crête efficacité bruit db charge db chargecapacité surchargede londuleur contourner après min contourner après sbatterie arrêt après secondes arrêt après secondestension batterie vdctypenuméro batterie v ahcourant charge max ainterface rs epokits intelligents option usb type b snmp contact sec protection contre surtensionslph mm poids kg,-0.05639037107663817
Coffre fort,75000.0,Thiaroye Dakar,objets valeurs toute sécurité mini coffrefort digital acier solide pouvez cacher objets tels bijoux argent papierselle dispose également dune doubleserrure poids partir kglivraison offerte dakar,-0.10194126806713869
Disjoncteur Ingelec,1.0,Patte d‘oie Dakar,disjoncteur marque ingelec disponible,-0.129227783429683
Dimension 200x1200 et 300x1200,9000.0,Keur Massar Dakar,porcelaine dimension x x vitrifier éclat mat salons chambre couloirsorigine inde italien espagnol tous disponibles,-0.1259537217522268
